id,name,category,alcoholic,glassType,instructions,isAlcoholic
115,French Negroni,Cocktail,Alcoholic,Martini Glass,"Add ice to a shaker and pour in all ingredients.
Using a bar spoon, stir 40 to 45 revolutions or until thoroughly chilled.
Strain into a martini glass or over ice into a rocks glass. Garnish with orange twist.",True
116,Fahrenheit 5000,Shot,Alcoholic,Shot glass,Cover bottom of shot glass with Tabasco Sauce and then fill with half Firewater and half Absolut Peppar.,True
117,Flying Dutchman,Ordinary Drink,Alcoholic,Old-fashioned glass,"In an old-fashioned glass almost filled with ice cubes, combine the gin and triple sec. Stir well.",True
118,Frozen Daiquiri,Ordinary Drink,Alcoholic,Champagne flute,"Combine all ingredients (except for the cherry) in an electric blender and blend at a low speed for five seconds, then blend at a high speed until firm. Pour contents into a champagne flute, top with the cherry, and serve.",True
119,Fruit Flip-Flop,Other / Unknown,Non alcoholic,Highball Glass,"Place all ingredients in the blender jar - cover and whiz on medium speed until well blended. Pour in one tall, 2 medium or 3 small glasses and drink up.",False
120,Flying Scotchman,Ordinary Drink,Alcoholic,Cocktail glass,"Shake all ingredients with ice, strain into a cocktail glass, and serve.",True
121,French Connection,Ordinary Drink,Alcoholic,Old-fashioned glass,Pour all ingredients directly into old fashioned glass filled with ice cubes. Stir gently.,True
122,Flaming Dr. Pepper,Shot,Alcoholic,Collins Glass,"Add Amaretto, Bacardi, and vodka. Mix in the Dr. Pepper and beer",True
123,Flaming Lamborghini,Cocktail,Alcoholic,Cocktail glass,"Pour the Sambuca and Kahlua into the Cocktail Glass and give the drinker a straw. Pour the Baileys and Blue Curacao into two sepsrate shot glasses either side of the cocktail glass. Set light the concotion in the cocktail glass and start to drink through the straw (this drink should be drunk in one) , as the bottom of the glass is reached put out the fire by pouring the Baileys and Blue Curacao into the cocktail glass and keep drinking till it's all gone!!",True
124,Flander's Flake-Out,Ordinary Drink,Alcoholic,Collins Glass,Bang 'em both in.,True
125,Frozen Mint Daiquiri,Ordinary Drink,Alcoholic,Old-fashioned glass,Combine all ingredients with 1 cup of crushed ice in an electric blender. Blend at a low speed for a short length of time. Pour into an old-fashioned glass and serve.,True
126,Frozen Pineapple Daiquiri,Ordinary Drink,Alcoholic,Cocktail Glass,Combine all ingredients with 1 cup of crushed ice in an electric blender. Blend at a low speed for a short length of time. Pour into a cocktail glass and serve.,True
127,GG,Ordinary Drink,Optional alcohol,Collins Glass,Pour the Galliano liqueur over ice. Fill the remainder of the glass with ginger ale and thats all there is to it. You now have a your very own GG.,False
128,Gimlet,Cocktail,Alcoholic,Martini Glass,"Add all the ingredients to a shaker and fill with ice.

Shake, and strain into a chilled cocktail glass or an Old Fashioned glass filled with fresh ice.

Garnish with a lime wheel.",True
129,Godchild,Ordinary Drink,Alcoholic,Champagne flute,"Shake all ingredients well with cracked ice, strain into a champagne flute, and serve.",True
130,Gin Fizz,Ordinary Drink,Alcoholic,Highball glass,"Shake all ingredients with ice cubes, except soda water. Pour into glass. Top with soda water.",True
131,Gin Sour,Ordinary Drink,Alcoholic,Whiskey sour glass,"In a shaker half-filled with ice cubes, combine the gin, lemon juice, and sugar. Shake well. Strain into a sour glass and garnish with the orange slice and the cherry.",True
132,Gagliardo,Cocktail,Alcoholic,Cocktail glass,"Shake well and serve in a cocktail glass. This is a home cocktail of American/Internet Bar del Pozzo, Pavia, Italy.",True
133,Godmother,Ordinary Drink,Alcoholic,Old-fashioned glass,Pour vodka and amaretto into an old-fashioned glass over ice and serve.,True
134,Godfather,Ordinary Drink,Alcoholic,Old-fashioned glass,Pour all ingredients directly into old fashioned glass filled with ice cubes. Stir gently.,True
135,Gluehwein,Punch / Party Drink,Optional alcohol,Irish coffee cup,"Boil sugar and spices in water, leave in the water for 30 minutes. Strain the spiced water and mix with the wine. Heat slowly until short of boiling temperature. (To remove alcohol, let it boil for a while.) You may add lemon or orange juice to taste. Serve in irish coffee cup.",False
136,Gin Tonic,Cocktail,Alcoholic,Highball glass,"Fill a highball glass with ice, pour the gin, top with tonic water and squeeze a lemon wedge and garnish with a lemon wedge.",True
137,Gin Toddy,Ordinary Drink,Alcoholic,Old-fashioned glass,"Mix powdered sugar and water in an old-fashioned glass. Add gin and one ice cube. Stir, add the twist of lemon peel, and serve.",True
138,Gin Smash,Ordinary Drink,Alcoholic,Old-fashioned glass,"Muddle sugar with carbonated water and mint sprigs in an old-fashioned glass. Add gin and 1 ice cube. Stir, add the orange slice and the cherry, and serve.",True
139,Gin Daisy,Ordinary Drink,Alcoholic,Old-fashioned glass,"In a shaker half-filled with ice cubes, combine the gin, lemon juice, sugar, and grenadine. Shake well. Pour into an old-fashioned glass and garnish with the cherry and the orange slice.",True
140,Gin Lemon,Cocktail,Alcoholic,Highball glass,"For the preparation of the gin lemon you will not need the shaker. Fill the tumbler with ice, pour the gin and lemonade over it. Gently mix and decorate with a slice of lemon. Those who prefer can also add a few mint leaves. Your gin lemon is ready to be served.",True
141,Gin Sling,Ordinary Drink,Alcoholic,Old-fashioned glass,Dissolve powdered sugar in mixture of water and juice of lemon. Add gin. Pour into an old-fashioned glass over ice cubes and stir. Add the twist of orange peel and serve.,True
142,Greyhound,Cocktail,Alcoholic,Collins glass,"Add the vodka to a Collins glass filled with ice.
Top with grapefruit juice and stir.

",True
143,Gin Rickey,Cocktail,Alcoholic,Highball glass,Half-fill a tall glass with ice. Mix the gin and Grenadine together and pour over the ice. Add the lime or lemon juice and top off with soda water. Decorate the glass with lime and/or lemon slices.,True
144,Gin Squirt,Ordinary Drink,Alcoholic,Highball glass,"Stir gin, grenadine, and powdered sugar with ice and strain into a highball glass over ice cubes. Fill with carbonated water and stir. Decorate with the pineapple chunks and the strawberries and serve.",True
145,Grand Blue,Ordinary Drink,Alcoholic,Old-fashioned glass,Serve in an old fashioned glass.,True
146,Gin Cooler,Ordinary Drink,Alcoholic,Collins glass,Stir powdered sugar and 2 oz. carbonated water in a collins glass. Fill glass with ice and add gin. Fill with carbonated water and stir. Add the lemon peel and the orange spiral so that the end of the orange spiral dangles over rim of glass.,True
147,Gin Swizzle,Ordinary Drink,Alcoholic,Highball glass,"In a shaker half-filled with ice cubes, combine the lime juice, sugar, gin, and bitters. Shake well. Almost fill a colling glass with ice cubes. Stir until the glass is frosted. Strain the mixture in the shaker into the glass and add the club soda.",True
148,Grass Skirt,Ordinary Drink,Alcoholic,Old-fashioned glass,"In a shaker half-filled with ice cubes, combine the gin, triple sec, pineapple juice, and grenadine. Shake well. Pour into an old-fashioned glass and garnish with the pineapple slice.",True
149,Grasshopper,Ordinary Drink,Alcoholic,Cocktail glass,Pour ingredients into a cocktail shaker with ice. Shake briskly and then strain into a chilled cocktail glass.,True
150,Grim Reaper,Ordinary Drink,Alcoholic,Old-fashioned glass,Mix Kahlua and 151 in glass. Quickly add ice and pour grenadine over ice to give ice red tint.,True
151,Gin and Soda,Cocktail,Alcoholic,Highball glass,"Pour the Gin and Soda water into a highball glass almost filled with ice cubes.
Stir well.
Garnish with the lime wedge.",True
152,H.D.,Coffee / Tea,Alcoholic,Beer mug,Mix the whisky and Baileys Cream in a beer-glass (at least 50 cl). Fill the rest of the glass with coffee.,True
153,Honey Bee,Cocktail,Alcoholic,Margarita glass,"Shake ingredients with crushed ice
",True
154,Hot Toddy,Cocktail,Alcoholic,Irish coffee cup,"STEP 1
Whisk the whisky and honey together and split between 2 heatproof glasses. Add half of the cinnamon stick to each, then top up with 200ml boiling water.

STEP 2
Add a splash of lemon juice to each, then taste and add more to your preference. Finish each with a slice of lemon, studded with a clove, and serve immediately.",True
155,Herbal flame,Coffee / Tea,Alcoholic,Mason jar,"Pour Hot Damn 100 in bottom of a jar or regular glass. Fill the rest of the glass with sweet tea. Stir with spoon, straw, or better yet a cinnamon stick and leave it in.",True
156,Horse's Neck,Ordinary Drink,Alcoholic,Highball glass,"Pour brandy and ginger ale directly into highball glass with ice cubes. Stir gently. Garnish with lemon zest. If desired, add dashes of Angostura Bitter.",True
157,Happy Skipper,Ordinary Drink,Alcoholic,Highball glass,"Pour Captain Morgan's Spiced Rum over ice, fill glass to top with Ginger Ale. Garnish with lime. Tastes like a cream soda. Named for the Gilligan's Island reference (""The Captain"" *in* ""Ginger"" is a Happy Skipper!)",True
158,Hunter's Moon,Cocktail,Alcoholic,Balloon Glass,"Put the Bombay Sapphire, Martini Bianco, sugar syrup & blackberries in a cocktail shaker with lots of ice and shake vigorously before pouring into a balloon glass, topping up with lemonade and garnishing with a wedge of orange.",True
159,Halloween Punch,Punch / Party Drink,Alcoholic,Punch bowl,"Tip the cherry juice, orange peel, chilli, cinnamon sticks, cloves and ginger into a large saucepan. Simmer for 5 mins, then turn off the heat. Leave to cool, then chill for at least 4 hrs, or up to 2 days – the longer you leave it the more intense the flavours. If serving to young children, take the chilli out after a few hours.

When you’re ready to serve, pour the juice into a jug. Serve in glass bottles or glasses and pop a straw in each. If you're adding vodka, do so at this stage. Dangle a fangs sweet from each glass.",True
160,Havana Cocktail,Ordinary Drink,Alcoholic,Cocktail glass,"In a shaker half-filled with ice cubes, combine all of the ingredients. Shake well. Strain into a cocktail glass.",True
161,Holloween Punch,Punch / Party Drink,Non alcoholic,Punch bowl,"Take a bunch of grape juice and a bunch of fizzy stuff (club soda, ginger ale, lemonlime, whatever). Mix them in a punch bowl. Take orange sherbet and lime sherbet. Scoop out scoops and float them in the punch, let them melt a little so that a nasty film spreads all over the top of the punch but there are still ""bubbles"" in it in the form of sherbet scoops. Looks horrible, tastes just fine.",False
162,Homemade Kahlua,Homemade Liqueur,Alcoholic,Collins Glass,"Dissolve sugar in 2 cups of boiling water and add corn syrup. Dissolve the instant coffee in the remaining water. Pour syrup and coffee in a gallon jug. Let it cool. Add vodka and vanilla when cold. For the best result, let the mixture ""mature"" for 4-5 weeks.",True
163,Hot Creamy Bush,Coffee / Tea,Alcoholic,Irish coffee cup,Combine all ingredients in glass,True
164,Harvey Wallbanger,Ordinary Drink,Alcoholic,Collins glass,"Stir the vodka and orange juice with ice in the glass, then float the Galliano on top. Garnish and serve.",True
165,Hawaiian Cocktail,Ordinary Drink,Alcoholic,Cocktail glass,"Shake all ingredients with ice, strain into a cocktail glass, and serve.",True
166,Hemingway Special,Ordinary Drink,Alcoholic,Cocktail glass,Pour all ingredients into a shaker with ice. Shake.,True
167,Highland Fling Cocktail,Ordinary Drink,Alcoholic,Cocktail glass,Stir all ingredients (except olive) with ice and strain into a cocktail glass. Add the olive and serve.,True
168,Hot Chocolate to Die for,Cocoa,Non alcoholic,Coffee mug,"Melt the chocolate, butter and vanilla in a double boiler. When just smooth stir in the cream.",False
169,Ipamena,Ordinary Drink,Non alcoholic,Wine Glass,"Cut half a lime into pieces, place in a shaker, add the sugar and crush. Measure the passion fruit juice, add it to the shaker and fill up with ice cubes. Close the shaker and shake vigorously. Pour the liquid into a glass, top up with ginger ale, stir with a teaspoon and then garnish the rim of the glass with a slice of lime",False
170,Ice Pick,Ordinary Drink,Alcoholic,Collins Glass,Put Vodka in glass fill with iced tea. Stir in lemon to taste.,True
171,Iced Coffee,Coffee / Tea,Non alcoholic,Coffee mug,Mix together until coffee and sugar is dissolved. Add milk. Shake well. Using a blender or milk shake maker produces a very foamy drink. Serve in coffee mug.,False
172,Irish Cream,Homemade Liqueur,Alcoholic,Irish coffee cup,Mix scotch and milk. Add half-and-half. Add rest.,True
173,Irish Coffee,Coffee / Tea,Alcoholic,Irish coffee cup,"Heat the coffee, whiskey and sugar; do not boil. Pour into glass and top with cream; serve hot.",True
174,Irish Spring,Ordinary Drink,Alcoholic,Collins glass,"Pour all ingredients (except orange slice and cherry) into a collins glass over ice cubes. Garnish with the slice of orange, add the cherry on top, and serve.",True
175,Imperial Fizz,Ordinary Drink,Alcoholic,Highball glass,"Shake all ingredients (except carbonated water) with ice and strain into a highball glass over two ice cubes. Fill with carbonated water, stir, and serve.",True
176,Irish Russian,Beer,Alcoholic,Highball glass,Add the ingredients in the order listed in the recipe. Care must be taken when adding the Guinness to prevent an excess of foam. Do Not add ice.,True
177,Imperial Cocktail,Cocktail,Alcoholic,Cocktail glass,Shake with ice and strain into cocktail glass.,True
178,Iced Coffee Fillip,Coffee / Tea,Alcoholic,Coffee mug,Mix together in a coffee mug and chill before serving.,True
179,Irish Curdling Cow,Cocktail,Alcoholic,Highball glass,"Pour Irish Cream, Vodka, and Bourbon in a glass. Add some ice and mix in the orange juice.",True
180,Jam Donut,Shot,Alcoholic,Shot glass,"Coat the rim of a shot glass with sugar using sugar syrup to stick. Add the Chambord raspberry liqueur to the shot glass, and carefully layer the Baileys Irish Cream on top. Serve.",True
181,Jitterbug,Cocktail,Alcoholic,Cocktail Glass,"Wet glass, dip rim in sugar. Then add Ice. Then add everything else. It's that simple!",True
182,Jackhammer,Ordinary Drink,Alcoholic,Collins Glass,"Serve over ice- Warning,Deadly!",True
183,Jelly Bean,Shot,Alcoholic,Cordial glass,mix equal parts in pony glass-tastes just like a jelly bean!,True
184,Jello shots,Shot,Alcoholic,Shot glass,"Boil 3 cups of water then add jello. Mix jello and water until jello is completely disolved. Add the two cups of vodka and mix together. Pour mixture into plastic shot glasses and chill until firm. Then, eat away...",True
185,Jamaica Kiss,Shake,Alcoholic,Hurricane glass,Fill a tumbler with ice cubes. Add a shot of Tia Maria and a shot of Jamaican light rum. Fill the tumbler with milk. Blend until smooth and serve immediately.,True
186,John Collins,Ordinary Drink,Alcoholic,Collins glass,Pour all ingredients directly into highball glass filled with ice. Stir gently. Garnish. Add a dash of Angostura bitters.,True
187,Japanese Fizz,Ordinary Drink,Alcoholic,Highball glass,"Shake all ingredients (except carbonated water) with ice and strain into a highball glass over two ice cubes. Fill with carbonated water, stir, and serve.",True
188,Jamaican Coffee,Coffee / Tea,Alcoholic,Champagne flute,"Stir the rum, coffee and water together. Top with the whipped cream. Sprinkle with a pinch of well ground coffee and drink with a straw.",True
189,Just a Moonmint,Shake,Non alcoholic,Highball Glass,"Place all ingredients in the blender jar - cover and whiz on medium speed until well blended. Pour in one tall, 2 medium or 3 small glasses and drink up.",False
190,Jewel Of The Nile,Ordinary Drink,Alcoholic,Cocktail glass,"In a mixing glass half-filled with ice cubes, combine all of the ingredients. Stir well. Strain into a cocktail glass.",True
191,Jack Rose Cocktail,Ordinary Drink,Alcoholic,Cocktail glass,"Shake all ingredients with ice, strain into a cocktail glass, and serve.",True
192,Jack's Vanilla Coke,Other / Unknown,Alcoholic,Old-fashioned glass,"After pouring in your ingredients, and adding 3-5 ice cubes, according to taste. Stir the drink with a stirrer to get the Vanilla off the bottom.",True
193,Kir,Ordinary Drink,Alcoholic,Wine Glass,"Add the crème de cassis to the bottom of the glass, then top up with wine.",True
194,Karsk,Ordinary Drink,Alcoholic,Highball glass,"Put a copper coin in a coffe-cup and fill up with coffee until you no longer see the coin, then add alcohol until you see the coin. Norwegian speciality.",True
195,Kamikaze,Ordinary Drink,Alcoholic,Cocktail glass,"Shake all ingredients together with ice. Strain into glass, garnish and serve.",True
196,Kir Royale,Ordinary Drink,Alcoholic,Champagne Flute,"Pour Creme de cassis in glass, gently pour champagne on top",True
197,Kiwi Lemon,Ordinary Drink,Alcoholic,Highball glass,Mix in highball glass. Stirr. Garnish with slice of kiwi.,True
198,Kurant Tea,Coffee / Tea,Alcoholic,Champagne flute,"Pour Absolut Kurant into a comfortably big tea-cup. Add the not too hot(!) apple tea and, if you like, some sugar. Enjoy!",True
199,Kioki Coffee,Coffee / Tea,Alcoholic,Coffee mug,Stir. Add whipped cream to the top.,True
200,Kiwi Martini,Cocktail,Alcoholic,Cocktail glass,"The kiwi martini is a very fun vodka cocktail and it is one of the best drinks that makes use of fresh fruit. Though there are a few recipes floating around, this is one of the easiest and it is an absolutely delightful green martini to drink.

For this recipe, you'll simply muddle slices of kiwi with simple syrup, then shake it with vodka. It's a drink that anyone can mix up in minutes and a perfect cocktail to show off your favorite vodka.",True
201,Kiss me Quick,Ordinary Drink,Alcoholic,Highball glass,mix in the glass,True
202,Kool-Aid Shot,Shot,Alcoholic,Old-fashioned glass,Pour into a large glass with ice and stir. Add a little cranberry juice to taste.,True
203,Kool First Aid,Shot,Alcoholic,Shot glass,"Add Kool Aid to a double shot glass, and top with rum. Slam and shoot.",True
204,Kentucky B And B,Ordinary Drink,Alcoholic,Brandy snifter,Pour the bourbon and Benedictine into a brandy snifter.,True
205,Kentucky Colonel,Ordinary Drink,Alcoholic,Cocktail glass,In a shaker half-filled with ice cubes combine the courbon and Benedictine. Shake and strain into a cocktail glass. Garnish with the lemon twist.,True
206,Kool-Aid Slammer,Shot,Alcoholic,Shot glass,"Fill half the shot glass with the kool-aid first. Then put a paper towel over the top of the glass and slowly pour in the vodka. If you do it right, you should be able to see that the two liquids are separated, with the vodka on top. Now slam it! The last thing you'll taste is the kool-aid.",True
207,Kiwi Papaya Smoothie,Other / Unknown,Non alcoholic,Highball Glass,Throw everything into a blender and liquify.,False
208,Kill the cold Smoothie,Other / Unknown,Non alcoholic,Highball glass,Juice ginger and lemon and add it to hot water. You may add cardomom.,False
209,Limeade,Other / Unknown,Non alcoholic,Highball glass,"In a large glass, put the lime juice and sugar, and stir well. Add cold seltzer water to fill. Put the lime peels in the glass. Drink. Repeat until limes or soda run out.",False
210,Lunch Box,Beer,Alcoholic,Pint glass,Fill a pint glass almost full with beer. Then fill the rest with orange juice (careful not to fill it to the top). Then take the shot of Amaretto and drop it in.,True
211,Lemon Drop,Cocktail,Alcoholic,Cocktail glass,Shake and strain into a chilled cocktail glass rimmed with sugar.,True
212,Lemon Shot,Shot,Alcoholic,Shot glass,"Mix Galliano and Absolut Citron in a shot glass, lay lemon wedge sprinkled with sugar over glass and pour a rum over wedge and glass. light rum with a lighter and let burn for a second. Do shot quickly and suck on lemon. If it is done correctly, this will taste like a shot of sweet lemonade.",True
213,Long vodka,Ordinary Drink,Alcoholic,Highball glass,"Shake a tall glass with ice cubes and Angostura, coating the inside of the glass. Por the vodka onto this, add 1 slice of lime and squeeze juice out of remainder, mix with tonic, stir and voila you have a Long Vodka",True
214,Lassi Khara,Other / Unknown,Non alcoholic,Highball Glass,Blend (frappe) in blender until frothy. Add torn curry leaves and serve cold.,False
215,Lassi Raita,Other / Unknown,Non alcoholic,Highball Glass,"Blend the yoghurt and ice cubes together, until the yoghurt becomes more liquid. Add sugar to taste. The lemon/lime is optional but it gives it a slightly tart taste. Dash of salt. Raita is also good for the summer. Instead of having a traditional salad you can make raita instead.",False
216,Lemouroudji,Other / Unknown,Non alcoholic,Highball Glass,"Juice the lemons. Peel and grate the ginger. Place the grated ginger and a liberal dash of the cayenne pepper into a piece of cheesecloth, and tie it into a knot. Let soak in the water. After 15 minutes or so, add the sugar, and the lemon juice. Chill, and serve.",False
217,Loch Lomond,Ordinary Drink,Alcoholic,Cocktail glass,"In a mixing glass half-filled with ice cubes, combine the Scotch, Drambuie, and vermouth. Stir well. Strain into a cocktail glass. Garnish with the lemon twist.",True
218,London Town,Ordinary Drink,Alcoholic,Cocktail glass,"In a mixing glass half-filled with ice cubes, combine all of the ingredients. Stir well. Strain into a cocktail glass.",True
219,Lassi - Mango,Other / Unknown,Non alcoholic,Highball glass,Put it all in a blender and pour over crushed ice. You can also use other fruits like strawberries and bananas.,False
220,Lassi - Sweet,Other / Unknown,Non alcoholic,Highball glass,Put all ingredients into a blender and blend until nice and frothy. Serve chilled.,False
221,Limona Corona,Beer,Alcoholic,Beer Glass,"Open the Corona. Fill the empty space in the neck in the bottle with the rum. The bottle should be filled to the top. Plug the bottle with your thumb or the palm of your hand. Turn the bottle upside-down so the rum and beer mix. Turn the bottle rightside-up, unplug, and drink.",True
222,Lord And Lady,Ordinary Drink,Alcoholic,Old-fashioned glass,Pour the rum and Tia Maria into an old-fashioned glass almost filled with ice cubes. Stir well.,True
223,Lady Love Fizz,Ordinary Drink,Alcoholic,Cocktail glass,"Shake all ingredients (except carbonated water) with ice and strain into a cocktail glass over two ice cubes. Fill with carbonated water, stir, and serve.",True
224,Long Island Tea,Ordinary Drink,Alcoholic,Highball glass,Combine all ingredients (except cola) and pour over ice in a highball glass. Add the splash of cola for color. Decorate with a slice of lemon and serve.,True
225,Lone Tree Cooler,Ordinary Drink,Alcoholic,Collins glass,"Stir powdered sugar and 2 oz. carbonated water in a collins glass. Fill glass with ice, add gin and vermouth, and stir. Fill with carbonated water and stir again. Add the twist of lemon peel and the orange spiral so that the end dangles over rim of glass.",True
226,Lone Tree Cocktail,Ordinary Drink,Alcoholic,Cocktail glass,"Stir ingredients with ice, strain into a cocktail glass, and serve.",True
227,Lazy Coconut Paloma,Cocktail,Alcoholic,Highball glass,Mix the coconut liqueur (preferably tequila) with the grapefruit juice and top with soda water. Garnish with a large grapefruit slice against the inside of the glass.,True
228,Long Island Iced Tea,Ordinary Drink,Alcoholic,Highball glass,Mix all contents in a highball glass and sitr gently. Add dash of Coca-Cola for the coloring and garnish with lemon or lime twist.,True
229,Lemon Elderflower Spritzer,Cocktail,Alcoholic,Highball glass,"Pour all ingredients over ice, stir and enjoy!
",True
230,Lassi - A South Indian Drink,Other / Unknown,Non alcoholic,Highball Glass,"Blend in a blender for 3 seconds. Lassi is one of the easiest things to make, and there are many ways of making it. Basically, it is buttermilk (yoghurt whisked with water), and you can choose almost any consistency that you like, from the thinnest to the thickest. Serve cold.",False
231,Melya,Coffee / Tea,Non alcoholic,Coffee mug,"Brew espresso. In a coffee mug, place 1 teaspoon of unsweetened powdered cocoa, then cover a teaspoon with honey and drizzle it into the cup. Stir while the coffee brews, this is the fun part. The cocoa seems to coat the honey without mixing, so you get a dusty, sticky mass that looks as though it will never mix. Then all at once, presto! It looks like dark chocolate sauce. Pour hot espresso over the honey, stirring to dissolve. Serve with cream.",False
232,Mojito,Cocktail,Alcoholic,Highball glass,Muddle mint leaves with sugar and lime juice. Add a splash of soda water and fill the glass with cracked ice. Pour the rum and top with soda water. Garnish and serve with straw.,True
233,Mimosa,Ordinary Drink,Alcoholic,Champagne flute,"Ensure both ingredients are well chilled, then mix into the glass. Serve cold.",True
234,Mai Tai,Ordinary Drink,Alcoholic,Collins glass,Shake all ingredients with ice. Strain into glass. Garnish and serve with straw.,True
235,Martini,Cocktail,Alcoholic,Cocktail glass,"Straight: Pour all ingredients into mixing glass with ice cubes. Stir well. Strain in chilled martini cocktail glass. Squeeze oil from lemon peel onto the drink, or garnish with olive.",True
236,Michelada,Cocktail,Alcoholic,Pint glass,"Mix the beer with tomato juice, freshly squeezed lime juice, and Worcestershire sauce, teriyaki sauce, soy sauce, or hot sauce.
Served In a chilled, salt-rimmed glass
",True
