id,name,category,alcoholic,glassType,instructions,isAlcoholic
237,Manhattan,Cocktail,Alcoholic,Cocktail glass,"Stirred over ice, strained into a chilled glass, garnished, and served up.",True
238,Margarita,Ordinary Drink,Alcoholic,Cocktail glass,"Rub the rim of the glass with the lime slice to make the salt stick to it. Take care to moisten only the outer rim and sprinkle the salt on it. The salt should present to the lips of the imbiber and never mix into the cocktail. Shake the other ingredients with ice, then carefully pour into the glass.",True
239,Mauresque,Cocktail,Alcoholic,Collins glass,"1 - Pour the Ricard (or pastis)
2 - Pour the orgeat syrup
3 - Finally pour the water and add ice cubes at your convenience.

Add the ice cubes at the end, otherwise the syrup and pastis do not mix well.",True
240,Mint Julep,Ordinary Drink,Alcoholic,Collins glass,"In a highball glass gently muddle the mint, sugar and water. Fill the glass with cracked ice, add Bourbon and stir well until the glass is well frosted. Garnish with a mint sprig.",True
241,Mudslinger,Punch / Party Drink,Alcoholic,Punch bowl,Add all contents to a large jug or punch bowl. Stir well!,True
242,Martinez 2,Cocktail,Alcoholic,Cocktail glass,"Add all ingredients to a mixing glass and fill with ice.

Stir until chilled, and strain into a chilled coupe glass.",True
243,Moranguito,Shot,Alcoholic,Shot glass,"first you put rhe absinthe, then put tequila, then put the Granadine syrup.",True
244,Miami Vice,Cocktail,Alcoholic,Cocktail glass,"First: Mix pina colada with 2.5 oz. of rum with ice(set aside). Second: Mix daiquiri with 2.5 oz. of rum with ice. Third: While frozen, add pina colda mix then daiquiri mix in glass (Making sure they do not get mixed together).",True
245,Moscow Mule,Punch / Party Drink,Alcoholic,Copper Mug,Combine vodka and ginger beer in a highball glass filled with ice. Add lime juice. Stir gently. Garnish.,True
246,Mulled Wine,Punch / Party Drink,Alcoholic,Collins Glass,"Simmer 3 cups water with, sugar, cloves, cinnamon sticks, and lemon peel in a stainless steel pot for 10 minutes. Add wine heat to a ""coffee temperature"" (DO NOT BOIL) then add the brandy.",True
247,Masala Chai,Coffee / Tea,Non alcoholic,Coffee Mug,Bring 2 cups of water to boil. Add all the ingredients and boil again for about 15 seconds. Let stand for a minute. Warm milk in a pot. Filter tea into cups. Add milk and sugar. That's IT.,False
248,Munich Mule,Cocktail,Alcoholic,Highball glass,"Fill glass with ice
Pour Gin and Lime Juice
Fill glass with Ginger Beer
Garnish with Cucumer and Lime slice",True
249,Mocha-Berry,Coffee / Tea,Alcoholic,Irish coffee cup,"pour 6 oz. of coffee in a mug or Irish coffee cup. add coca mix and chambord, mix well and top off with whipped cream.",True
250,Mango Mojito,Cocktail,Alcoholic,Jar,"Squeeze the juice from 1½ limes and blend with the mango to give a smooth purée.
Cut the rest of the limes into quarters, and then cut each wedge in half again. Put 2 pieces of lime in a highball glass for each person and add 1 teaspoon of caster sugar and 5-6 mint leaves to each glass. Squish everything together with a muddler or the end of a rolling pin to release all the flavours from the lime and mint.
Divide the mango purée between the glasses and add 30ml white rum and a handful of crushed ice to each one, stirring well to mix everything together. Top up with soda water to serve and garnish with extra mint, if you like.",True
251,Mojito Extra,Cocktail,Alcoholic,Collins glass,"Put mint with lemon juice in a glas, mash the mint with a spoon, ice, rum & fill up with club soda. Top it with Angostura.",True
252,Monkey Gland,Ordinary Drink,Alcoholic,Cocktail glass,"Shake well over ice cubes in a shaker, strain into a chilled cocktail glass.",True
253,Midnight Mint,Cocktail,Alcoholic,Cocktail glass,"If available, rim cocktail (Martini) glass with sugar syrup then dip into chocolate flakes or powder. Add ingredients into shaker with ice. Shake well then strain into cocktail glass.",True
254,Mary Pickford,Cocktail,Alcoholic,Cocktail glass,Shake and strain into a chilled large cocktail glass,True
255,Monkey Wrench,Ordinary Drink,Alcoholic,Old-fashioned glass,Pour all of the ingredients into an old-fashioned glass almost filled with ice cubes. Stir well.,True
256,Negroni,Ordinary Drink,Alcoholic,Old-fashioned glass,"Stir into glass over ice, garnish and serve.",True
257,New York Sour,Ordinary Drink,Alcoholic,Whiskey sour glass,"Shake blended whiskey, juice of lemon, and powdered sugar with ice and strain into a whiskey sour glass. Float claret on top. Decorate with the half-slice of lemon and the cherry and serve.",True
258,Nutty Irishman,Shake,Alcoholic,Highball Glass,Serve over ice,True
259,National Aquarium,Ordinary Drink,Alcoholic,Collins Glass,Pour all ingredients into a shaker of ice. Shake well. Serve on the rocks.,True
260,New York Lemonade,Cocktail,Alcoholic,Cocktail glass,Serve in a chilled cocktail glass. Lemon and sugar the rim. Stir and Strain.,True
261,Nuked Hot Chocolate,Cocoa,Non alcoholic,Coffee mug,"Mix with a bit of milk (1 oz or so) in coffee mug. Nuke mug for about 30-50 seconds. Stir until the heated cocoa dissolves. Fill mug with milk. Nuke for 1-2 minutes, depending on wattage and preferences as to burnt mouth parts.",False
262,Orgasm,Ordinary Drink,Alcoholic,Cocktail glass,"Shake all ingredients with ice, strain into a chilled cocktail glass, and serve.",True
263,Old Pal,Cocktail,Alcoholic,Nick and Nora Glass,"Chill cocktail glass. Add ingredients to a mixing glass, and fill 2/3 full with ice. Stir about 20 seconds. Empty cocktail glass and strain into the glass. Garnish with a twist of lemon peel.",True
264,Orangeade,Cocktail,Non alcoholic,Highball glass,"Place some ice cubes in a large tumbler or highball glass, add lemon juice, orange juice, sugar syrup, and stir well. Top up with cold soda water, serve with a drinking straw.",False
265,Orange Whip,Other / Unknown,Alcoholic,Collins Glass,Pour ingredients over ice and stir.,True
266,Orange Crush,Shot,Alcoholic,Shot glass,Add all ingredients to tumbler-Pour as shot,True
267,Orange Oasis,Ordinary Drink,Alcoholic,Highball glass,"Shake brandy, gin, and orange juice with ice and strain into a highball glass over ice cubes. Fill with ginger ale, stir, and serve.",True
268,Old Fashioned,Cocktail,Alcoholic,Old-fashioned glass,"Place sugar cube in old fashioned glass and saturate with bitters, add a dash of plain water. Muddle until dissolved.
Fill the glass with ice cubes and add whiskey.

Garnish with orange twist, and a cocktail cherry.",True
269,Oreo Mudslide,Ordinary Drink,Alcoholic,Collins Glass,"Blend Vodka, Kahlua, Bailey's, ice-cream and the Oreo well in a blender. Pour into a large frosted glass. Garnish with whipped cream and a cherry.",True
270,Oatmeal Cookie,Cocktail,Alcoholic,Mason jar,"Just mix it all together.
It's meant to be a shot, but it works just fine as a proper adult-sized drink over lots of ice.

Tastes like an oatmeal cookie.",True
271,Orange Push-up,Ordinary Drink,Alcoholic,Hurricane glass,Combine liquors in a blender. Add a half scoop of ice and blend. Garnish with an orange and cherry flag. So good it will melt in your mouth!!!,True
272,Orange Rosemary Collins,Cocktail,Alcoholic,Highball glass,Add the spirits to the bottom of the glass and top equally with the mixer drinks. Garnish with orange slices inside the glass as well as some rosemary on top.,True
273,Orange Scented Hot Chocolate,Cocoa,Non alcoholic,Coffee mug,"Combine all ingredients in heavy medium saucepan. Stir over low heat until chocolate melts. Increase heat and bring just to a boil, stirring often. Remove from heat and whisk untily frothy. Return to heat and bring to boil again. Remove from heat, whisk until frothy. Repeat heating and whisking once again. Discard orange peel. (Can be prepared 2 hours ahead. Let stand at room temperature. Before serving, bring just to boil, remove from heat and whisk until frothy.) Pour hot chocolate into coffee mugs. Makes 2 servings.",False
274,Owen's Grandmother's Revenge,Ordinary Drink,Alcoholic,Highball glass,Add ingredients and mix in blender.,True
275,Paloma,Cocktail,Alcoholic,Collins glass,Stir together and serve over ice.,True
276,Paradise,Ordinary Drink,Alcoholic,Cocktail glass,Shake together over ice. Strain into cocktail glass and serve chilled.,True
277,Pink Gin,Ordinary Drink,Alcoholic,White wine glass,"Pour the bitters into a wine glass. Swirl the glass to coat the inside with the bitters, shake out the excess. Pour the gin into the glass. Do not add ice.",True
278,Pegu Club,Cocktail,Alcoholic,Cocktail glass,"Shake, strain, up, cocktail glass",True
279,Pink Lady,Ordinary Drink,Alcoholic,Cocktail glass,"Shake all ingredients with ice, strain into a cocktail glass, and serve.",True
280,Pink Moon,Cocktail,Alcoholic,Whiskey Glass,"Slowly shake in a shaker with ice, strain into a square whiskey glass. Top with fresh ice. Add the blackberries to garnish. Add flowers and a green leaf for a special look!",True
281,Penicillin,Cocktail,Alcoholic,Old-fashioned glass,"Shake blended Scotch, lemon juice, honey syrup and ginger syrup with ice. Strain over large ice in chilled rocks glass. Float smoky Scotch on top (be sure to use a smoky Scotch such as an Islay single malt). Garnish with candied ginger.",True
282,Pisco Sour,Cocktail,Alcoholic,Cocktail glass,"Vigorously shake and strain contents in a cocktail shaker with ice cubes, then pour into glass and garnish with bitters.
",True
283,Porto flip,Ordinary Drink,Alcoholic,Cocktail glass,"Shake ingredients together in a mixer with ice. Strain into glass, garnish and serve.",True
284,Pina Colada,Ordinary Drink,Alcoholic,Collins glass,"Mix with crushed ice in blender until smooth. Pour into chilled glass, garnish and serve.",True
285,Pink Penocha,Punch / Party Drink,Alcoholic,Punch bowl,mix all ingredients into bowl keep iced stir frequently,True
286,Pure Passion,Cocktail,Alcoholic,Whiskey sour glass,Mix up all ingredients with a cocktail stirrer and serve with crushed ice with mint and edible flour if available.,True
287,Popped cherry,Ordinary Drink,Alcoholic,Highball glass,Served over ice in a tall glass with a popped cherry (can add more popped cherries if in the mood)!,True
288,Poppy Cocktail,Ordinary Drink,Alcoholic,Cocktail glass,"Shake ingredients with ice, strain into a cocktail glass, and serve.",True
289,Port Wine Flip,Ordinary Drink,Alcoholic,Whiskey sour glass,Shake all ingredients (except nutmeg) with ice and strain into a whiskey sour glass. Sprinkle nutmeg on top and serve.,True
290,Planter's Punch,Punch / Party Drink,Alcoholic,Collins glass,"Pour all ingredients, except the bitters, into shaker filled with ice. Shake well. Pour into large glass, filled with ice. Add Angostura bitters, ""on top"". Garnish with cocktail cherry and pineapple.",True
291,Pineapple Paloma,Cocktail,Alcoholic,Collins glass,"Rub the rim of each glass with lime slice and dip into salt.
Add ice, tequila, grapefruit juice, lime juice and top with pineapple soda.
Give it a quick stir.
Garnish with fresh pineapple or lime.",True
292,Pornstar Martini,Cocktail,Alcoholic,Cocktail glass,Straight: Pour all ingredients into mixing glass with ice cubes. Shake well. Strain in chilled martini cocktail glass. Cut passion fruit in half and use as garnish. Pour prosecco into a chilled shot glass and serve alongside the martini.,True
293,Planter’s Punch,Cocktail,Alcoholic,Highball glass,Squeeze an orange and strain the juice. Put all the ingredients in a shaker filled with ice and shake for at least 12 seconds. Strain into a highball glass and decorate with a pineapple wedge or fruit of your choice.,True
294,Port And Starboard,Ordinary Drink,Alcoholic,Pousse cafe glass,"Pour carefully into a pousse-cafe glass, so that creme de menthe floats on grenadine. Serve without mixing.",True
295,Port Wine Cocktail,Ordinary Drink,Alcoholic,Cocktail glass,"Stir ingredients with ice, strain into a cocktail glass, and serve.",True
296,Pysch Vitamin Light,Ordinary Drink,Non alcoholic,Collins Glass,Shake with ice.,False
297,Pink Panty Pulldowns,Ordinary Drink,Alcoholic,Collins Glass,Shake well,True
298,Passion Fruit Martini,Cocktail,Alcoholic,Cocktail glass,Pour all ingredients into a glass and stir. Garnish with half a passion fruit piece.,True
299,Pineapple Gingerale Smoothie,Other / Unknown,Non alcoholic,Highball Glass,Throw everything into a blender and liquify.,False
300,Quentin,Ordinary Drink,Alcoholic,Cocktail glass,"In a shaker half-filled with ice cubes, combine the rum, Kahlua, and cream. Shake well. Strain into a cocktail glass and garnish with the nutmeg.",True
301,Queen Bee,Ordinary Drink,Alcoholic,Cocktail glass,"Shake all ingredients with ice, strain into a cocktail glass, and serve.",True
302,Quick F**K,Shot,Alcoholic,Shot glass,"In a shot glass add 1/3 Kahlua first. Then 1/3 Miduri, topping it off with a 1/3 bailey's irish cream",True
303,Quick-sand,Ordinary Drink,Alcoholic,Highball glass,"Simply add the orange juice, quite a quick pour in order to mix the sambucca with the orange juice. The juice MUST have fruit pulp!",True
304,Queen Charlotte,Ordinary Drink,Alcoholic,Collins glass,"Pour red wine and grenadine into a collins glass over ice cubes. Fill with lemon-lime soda, stir, and serve.",True
305,Queen Elizabeth,Ordinary Drink,Alcoholic,Cocktail glass,"Stir all ingredients with ice, strain into a cocktail glass, and serve.",True
306,Quaker's Cocktail,Ordinary Drink,Alcoholic,Cocktail glass,"Shake all ingredients with ice, strain into a cocktail glass, and serve.",True
307,Quarter Deck Cocktail,Ordinary Drink,Alcoholic,Cocktail glass,"Stir all ingredients with ice, strain into a cocktail glass, and serve.",True
308,Rose,Ordinary Drink,Alcoholic,Cocktail glass,"Shake together in a cocktail shaker, then strain into chilled glass. Garnish and serve.",True
309,Radler,Ordinary Drink,Alcoholic,Highball glass,"Pour beer into large mug, slowly add the 7-up (or Sprite).",True
310,Rum Sour,Ordinary Drink,Alcoholic,Whiskey sour glass,"In a shaker half-filled with ice cubes, combine the rum, lemon juice, and sugar. Shake well. Strain into a sour glass and garnish with the orange slice and the cherry.",True
311,Rum Punch,Punch / Party Drink,Alcoholic,Punch bowl,Mix all ingredients in a punch bowl and serve.,True
312,Rum Toddy,Ordinary Drink,Alcoholic,Old-fashioned glass,Dissolve powdered sugar in water in an old-fashioned glass. Add rum and one ice cube and stir. Add the twist of lemon peel and serve.,True
313,Royal Fizz,Ordinary Drink,Alcoholic,Collins glass,Shake all ingredients (except cola) with ice and strain into a chilled collins glass. Fill with cola and serve.,True
314,Rum Cooler,Ordinary Drink,Alcoholic,Collins glass,Pour the rum and soda into a collins glass almost filled with ice cubes. Stir well and garnish with the lemon wedge.,True
315,Rum Runner,Punch / Party Drink,Alcoholic,Cocktail glass,Mix all ingredients in glass & add ice.,True
316,Rusty Nail,Ordinary Drink,Alcoholic,Old-fashioned glass,Pour the Scotch and Drambuie into an old-fashioned glass almost filled with ice cubes. Stir well. Garnish with the lemon twist.,True
317,Red Snapper,Shot,Alcoholic,Old-fashioned glass,"One shot each, shake n shoot",True
318,Royal Bitch,Shot,Alcoholic,Shot glass,Into a shot glass layer the Crown Royal on top of the Frangelico.,True
319,Royal Flush,Shot,Alcoholic,Old-fashioned glass,Pour all the ingredients into tumbler over ice. Strain into glass.,True
320,Rum Cobbler,Ordinary Drink,Alcoholic,Old-fashioned glass,"In an old-fashioned glass, dissolve the sugar in the club soda. Add crushed ice until the glass is almost full. Add the rum. Stir well. Garnish with the cherry and the orange and lemon slices.",True
321,Ruby Tuesday,Cocktail,Alcoholic,Highball glass,Pour gin and cranberry into a highball filled with ice cubes. Add grenadine and stir.,True
322,Rail Splitter,Cocktail,Non alcoholic,Highball glass,Mix sugar syrup with lemon juice in a tall glass. Fill up with ginger ale.,False
323,Rosemary Blue,Cocktail,Alcoholic,Balloon Glass,"1) Add the Bombay Sapphire, Blue Curacao, rosemary sprig and gently squeezed lemon wedge to a balloon glass. Swirl well to combine.
2) Fill with cubed ice and top with the Fever-Tree Light Tonic Water.
3) Gently fold with a bar spoon to mix.",True
324,Ramos Gin Fizz,Cocktail,Alcoholic,Highball glass,"Prepare all the ingredients on the counter to be able to work well and quickly, especially the cream and egg white.

Pour all the ingredients into a shaker.

Shake vigorously for 1 minute: cream and egg white must be mixed perfectly, so don't rush.

Now open the shaker and put some ice and shake for 1-2 minutes. It depends on how long you can resist!

Pour into a highball glass, add a splash of soda and garnish to taste.

Ramos Gin Fizz was once drunk as an invigorating drink or even as a breakfast, try it as an aperitif and after dinner and you will discover a little gem now lost.",True
325,Royal Gin Fizz,Ordinary Drink,Alcoholic,Highball glass,"Shake all ingredients (except carbonated water) with ice and strain into a highball glass over two ice cubes. Fill with carbonated water, stir, and serve.",True
326,Rum Milk Punch,Ordinary Drink,Alcoholic,Collins glass,Shake all ingredients (except nutmeg) with ice and strain into a collins glass. Sprinkle nutmeg on top and serve.,True
327,Raspberry Julep,Cocktail,Alcoholic,Cordial glass,"Softly muddle the mint leaves and raspberry syrup in the bottom of the cup. Add crushed ice and Bourbon to the cup and then stir. Top with more ice, garnish with a mint sprig.",True
328,Rum Screwdriver,Ordinary Drink,Alcoholic,Highball glass,"Pour rum into a highball glass over ice cubes. Add orange juice, stir, and serve.",True
329,Raspberry Cooler,Other / Unknown,Alcoholic,Highball glass,Pour the raspberry vodka and soda into a highball glass almost filled with ice cubes. Stir well.,True
330,Rum Old-fashioned,Ordinary Drink,Alcoholic,Old-fashioned glass,"Stir powdered sugar, water, and bitters in an old-fashioned glass. When sugar has dissolved add ice cubes and light rum. Add the twist of lime peel, float 151 proof rum on top, and serve.",True
331,Russian Spring Punch,Ordinary Drink,Alcoholic,Highball glass,"Pour the ingredients into an highball glass, top with Sparkling wine.",True
332,Radioactive Long Island Iced Tea,Ordinary Drink,Alcoholic,Collins Glass,Pour all ingredients over ice in a very tall glass. Sip cautiously.,True
333,Smut,Punch / Party Drink,Alcoholic,Beer mug,Throw it all together and serve real cold.,True
334,Spritz,Ordinary Drink,Alcoholic,Old-Fashioned glass,"Build into glass over ice, garnish and serve.",True
335,Scooter,Ordinary Drink,Alcoholic,Cocktail glass,"Shake all ingredients well with cracked ice, strain into a cocktail glass, and serve.",True
336,Sangria,Punch / Party Drink,Alcoholic,Pitcher,Mix all together in a pitcher and refrigerate. Add cloves and cinnamon sticks to taste. Serve in wine glasses.,True
337,Stinger,Ordinary Drink,Alcoholic,Cocktail glass,"Pour in a mixing glass with ice, stir and strain into a cocktail glass. May also be served on rocks in a rocks glass.",True
338,Sazerac,Ordinary Drink,Alcoholic,Old-fashioned glass,"Rinse a chilled old-fashioned glass with the absinthe, add crushed ice, and set it aside. Stir the remaining ingredients over ice and set it aside. Discard the ice and any excess absinthe from the prepared glass, and strain the drink into the glass. Add the lemon peel for garnish.",True
339,Sidecar,Ordinary Drink,Alcoholic,Cocktail glass,Pour all ingredients into cocktail shaker filled with ice. Shake well and strain into cocktail glass.,True
340,Snowday,Cocktail,Alcoholic,Collins glass,Stir all ingredients with ice. Strain into a chilled rocks glass over fresh ice. Express orange peel over drink and garnish.,True
341,Spice 75,Cocktail,Alcoholic,Wine Glass,"Gently warm 60g golden caster sugar in a pan with 30ml water and 1 tbsp allspice. Cook gently until the sugar has dissolved, then leave the mixture to cool. Strain through a sieve lined with a coffee filter (or a double layer of kitchen paper).

Pour 60ml of the spiced syrup into a cocktail shaker along with 200ml rum and 90ml lime juice. Shake with ice and strain between six flute glasses. Top up with 600ml champagne and garnish each with an orange twist.",True
342,Snowball,Ordinary Drink,Alcoholic,Highball glass,Place one ice cube in the glass and add 1 1/2 oz of Advocaat. Fill up the glass with lemonade and decorate with a slice of lemon. Serve at once.,True
343,Shot-gun,Shot,Alcoholic,Shot glass,Pour one part Jack Daneils and one part Jim Beam into shot glass then float Wild Turkey on top.,True
344,Salty Dog,Ordinary Drink,Alcoholic,Highball glass,"Pour all ingredients over ice cubes in a highball glass. Stir well and serve. (Vodka may be substituted for gin, if preferred.)",True
345,Stone Sour,Ordinary Drink,Alcoholic,Whiskey sour glass,"Shake all ingredients with ice, strain into a chilled whiskey sour glass, and serve.",True
346,Sea breeze,Ordinary Drink,Alcoholic,Highball glass,Build all ingredients in a highball glass filled with ice. Garnish with lime wedge.,True
347,Scotch Sour,Ordinary Drink,Alcoholic,Whiskey sour glass,"Shake scotch, juice of lime, and powdered sugar with ice and strain into a whiskey sour glass. Decorate with 1/2 slice lemon, top with the cherry, and serve.",True
348,Sweet Tooth,Shake,Alcoholic,Highball Glass,"Put 2 shots Godiva Liquour into a glass, add as much or as little milk as you would like.",True
349,Screwdriver,Ordinary Drink,Alcoholic,Highball glass,Mix in a highball glass with ice. Garnish and serve.,True
350,Sherry Flip,Ordinary Drink,Alcoholic,Nick and Nora Glass,Shake all ingredients (except nutmeg) with ice and strain into a whiskey sour glass. Sprinkle nutmeg on top and serve.,True
351,Sol Y Sombra,Ordinary Drink,Alcoholic,Brandy snifter,"Shake ingredients with ice, strain into a brandy snifter, and serve. (The English translation of the name of this drink is ""Sun and Shade"", and after sampling this drink, you'll understand why. Thanks, Kirby.)",True
352,Shark Attack,Cocktail,Alcoholic,Pitcher,Mix lemonade and water according to instructions on back of can. If the instructions say to add 4 1/3 cans of water do so. Mix into pitcher. Add 1 1/2 cup of Vodka (Absolut). Mix well. Pour into glass of crushed ice. Excellent!,True
353,San Francisco,Ordinary Drink,Alcoholic,Highball glass,"Take a tall glass and put in a few ice cubes, fill the vodka over it and fill with juice then the ""creme"", to end fill in the grenadine but very carefully at the side of the glass so it will lay down in the bottom. garnish with orange and strawberry.",True
354,Space Odyssey,Ordinary Drink,Alcoholic,Highball glass,Fill glass with ice and add shots of Bacardi and Malibu. Add splash of pineapple juice and top with orange juice. Add grenadine for color and garnish with cherries.,True
355,Sherry Eggnog,Ordinary Drink,Alcoholic,Collins glass,"Shake sherry, powdered sugar, and egg with ice and strain into a collins glass. Fill with milk and stir. Sprinkle nutmeg on top and serve.",True
356,Sweet Bananas,Shake,Non alcoholic,Highball Glass,"Place all ingredients in the blender jar - cover and whiz on medium speed until well blended. Pour in one tall, 2 medium or 3 small glasses and drink up.",False
357,Sweet Sangria,Punch / Party Drink,Alcoholic,Pitcher,"Dissolve the sugar in hot water and cool. Peel the citrus fruits and break into wedges. Mix the wine, sugar syrup, fruit, and Fresca in a pitcher and put in the fridge for a few hours. Serve in tall glasses with a straw.",True
358,Thriller,Ordinary Drink,Alcoholic,Cocktail glass,"In a shaker half-filled with ice cubes, combine all of the ingredients. Shake well. Strain into a cocktail glass.",True
359,The Galah,Cocktail,Alcoholic,Collins glass,Mix together the alcoholic portions and top with Pineapple and Lime juice.,True
360,Tia-Maria,Homemade Liqueur,Alcoholic,Collins Glass,"Boil water, sugar and coffe for 10 mins and let cool. Add rum and vanilla. Put in clean bottle(s) and leave for 1 week before using.",True
361,Tipperary,Cocktail,Alcoholic,Nick and Nora Glass,"Stir over ice. Strain into chilled glass. Cut a wide swath of orange peel, and express the orange oils over the drink. Discard orange twist.",True
362,Turkeyball,Shot,Alcoholic,Shot glass,Shake with ice and strain into a shot glass.,True
363,Texas Sling,Shake,Alcoholic,Wine Glass,"Blend with Ice until smooth. Serve in a tulip glass, top with whip cream.",True
364,Thai Coffee,Coffee / Tea,Non alcoholic,Highball glass,"Place the coffee and spices in the filter cone of your coffee maker. Brew coffee as usual, let it cool. In a tall glass, dissolve 1 or 2 teaspoons of sugar in an ounce of the coffee (it's easier to dissolve than if you put it right over ice). Add 5-6 ice cubes and pour coffee to within about 1 inch of the top of the glass. Rest a spoon on top of the coffee and slowly pour whipping cream into the spoon. This will make the cream float on top of the coffee rather than dispersing into it right away.",False
365,Tom Collins,Ordinary Drink,Alcoholic,Collins glass,"In a shaker half-filled with ice cubes, combine the gin, lemon juice, and sugar. Shake well. Strain into a collins glass alomst filled with ice cubes. Add the club soda. Stir and garnish with the cherry and the orange slice.",True
366,Tomato Tang,Other / Unknown,Non alcoholic,Highball glass,"Place all ingredients in the blender jar - cover and whiz on medium speed until well blended. Pour in one tall, 2 medium or 3 small glasses and drink up.",False
367,Talos Coffee,Coffee / Tea,Alcoholic,Brandy snifter,Add your GM and then add your coffee.,True
368,Tennesee Mud,Coffee / Tea,Alcoholic,Coffee Mug,"Mix Coffee, Jack Daniels and Amaretto. Add Cream on top.",True
