id,name,category,alcoholic,glassType,instructions,isAlcoholic
369,Tequila Fizz,Ordinary Drink,Alcoholic,Collins glass,"Shake all ingredients (except ginger ale) with ice and strain into a collins glass over ice cubes. Fill with ginger ale, stir, and serve.",True
370,Tequila Sour,Ordinary Drink,Alcoholic,Whiskey sour glass,"Shake tequila, juice of lemon, and powdered sugar with ice and strain into a whiskey sour glass. Add the half-slice of lemon, top with the cherry, and serve.",True
371,Thai Iced Tea,Coffee / Tea,Non alcoholic,Highball glass,"Combine Thai tea (i.e., the powder), boiling water, and sweetened condensed milk, stir until blended. Pour into 2 tall glasses filled with ice cubes. Garnish with mint leaves. Makes 2 servings.",False
372,The Last Word,Cocktail,Alcoholic,Cocktail glass,Shake with ice and strain into a cocktail glass.,True
373,Turf Cocktail,Ordinary Drink,Alcoholic,Cocktail glass,Stir all ingredients (except orange peel) with ice and strain into a cocktail glass. Add the twist of orange peel and serve.,True
374,The Laverstoke,Cocktail,Alcoholic,Balloon Glass,"1) Squeeze two lime wedges into a balloon glass then add the cordial, Bombay Sapphire and MARTINI Rosso Vermouth, swirl to mix.

2) Fully fill the glass with cubed ice and stir to chill.

3) Top with Fever-Tree Ginger Ale and gently stir again to combine.

4) Garnish with a snapped ginger slice and an awoken mint sprig.",True
375,Tequila Slammer,Shot,Alcoholic,Hurricane glass,Mix carefully to avoid releasing the dissolved CO2.,True
376,Tequila Sunrise,Cocktail,Alcoholic,Highball glass,"Pour the tequila and orange juice into glass over ice. Add the grenadine, which will sink to the bottom. Stir gently to create the sunrise effect. Garnish and serve.",True
377,The Philosopher,Cocktail,Alcoholic,Margarita glass,"Add all the spirits in a shaker (best to use Hendricks gin) as well as the orange bitters and lemon juice. Strain into a Margarita glass, top with Prosecco.",True
378,Tuxedo Cocktail,Ordinary Drink,Alcoholic,Cocktail glass,Stir all ingredients with ice and strain into a cocktail glass. Garnish with a cherry and a twist of lemon zest.,True
379,Tequila Surprise,Shot,Alcoholic,Shot glass,Fill shot glass with Tequila. Add drops of Tobasco sauce.,True
380,Thai Iced Coffee,Coffee / Tea,Non alcoholic,Highball glass,"Prepare a pot of coffee at a good European strength. In the ground coffee, add 2 or 3 freshly ground cardamom pods. Sweeten while hot, then cool quickly. Serve in highball glass over ice, with cream. To get the layered effect, place a spoon atop the coffee and pour the milk carefully into the spoon so that it floats on the top of the coffee.",False
381,The Jimmy Conway,Cocktail,Alcoholic,Whiskey sour glass,"Fill glass with ice
Pour in The Irishman and Disaronno
Fill to the top with Cranberry Juice
Garnish with a slice of lemon…Enjoy!",True
382,Texas Rattlesnake,Shot,Alcoholic,Highball glass,"Mix all ingredients and Shake well. Sweet at first, with a BITE at the end...",True
383,Vesper,Cocktail,Alcoholic,Cocktail glass,"Shake over ice until well chilled, then strain into a deep goblet and garnish with a thin slice of lemon peel.",True
384,Victor,Ordinary Drink,Alcoholic,Cocktail glass,"Shake all ingredients with ice, strain into a cocktail glass, and serve.",True
385,Vampiro,Ordinary Drink,Alcoholic,Old-Fashioned glass,"Vampiros may be made in a tall glass or an old fashioned glass. Bartenders may first ""rim"" the glass with Kosher Salt, which is done by placing a layer of Kosher Salt on a chopping board, moistening the glass' rim with lime juice or water, and then placing the upside down glass rim onto the Kosher Salt, so that the salt sticks to the moistened rim. The second step is to fill half the glass with ice and add one or two shooter glasses full of high quality Tequila. The next stage is to add the flavouring elements. This is done by squeezing a fresh lime into the glass, adding a few grains of salt, adding citrus-flavoured soda pop, until the glass is 4/5 full, and then adding spicy Viuda de Sanchez (or orange juice, lime juice and pico de gallo). The final step is to stir the ingredients so that the flavours are properly blended.",True
386,Vesuvio,Ordinary Drink,Alcoholic,Old-fashioned glass,"Shake all ingredients with ice, strain into an old-fashioned glass over ice cubes, and serve.",True
387,Veteran,Ordinary Drink,Alcoholic,Old-fashioned glass,Pour the rum and cherry brandy into an old-fashioned glass almost filled with ice cubes. Stir well.,True
388,Van Vleet,Ordinary Drink,Alcoholic,Old-fashioned glass,"Shake all ingredients with ice, strain into an old-fashioned glass over ice cubes, and serve.",True
389,Vodka Fizz,Other / Unknown,Alcoholic,White wine glass,"Blend all ingredients, save nutmeg. Pour into large white wine glass and sprinkle nutmeg on top.",True
390,Vodka Lemon,Cocktail,Alcoholic,Highball glass,"The vodka lemon is prepared directly in a highball glass or in a large tumbler: put 6-7 ice cubes in the glass, pour the vodka, lemonade and mix with a bar spoon. Finally decorate with a slice of lemon and, if you prefer, add a few mint leaves. Your vodka lemon is ready to be served.",True
391,Vodka Slime,Cocktail,Alcoholic,Highball glass,"Fill glass with ice. Add vodka, 7-up then finish with the lime juice.",True
392,Vodka Tonic,Cocktail,Alcoholic,Highball glass,"Wash and cut 1 wedge and 1 slice of lime or lemon.
Fill a tumbler with fresh ice.
Pour the desired dose of vodka and top up with the tonic.
Squeeze the lime wedge into the glass and decorate with the slice.
That's all, very simple: it's just the recipe for happiness!",True
393,Vodka Martini,Ordinary Drink,Alcoholic,Cocktail glass,"Shake the vodka and vermouth together with a number of ice cubes, strain into a cocktail glass, add the olive and serve.",True
394,Vodka Russian,Ordinary Drink,Alcoholic,Collins Glass,Mix it as a ordinary drink .,True
395,Vermouth Cassis,Ordinary Drink,Alcoholic,Highball glass,"Stir vermouth and creme de cassis in a highball glass with ice cubes. Fill with carbonated water, stir again, and serve.",True
396,Victory Collins,Ordinary Drink,Alcoholic,Collins glass,Shake all ingredients (except orange slice) with ice and strain into a collins glass over ice cubes. Add the slice of orange and serve.,True
397,Vodka And Tonic,Ordinary Drink,Alcoholic,Highball glass,"Pour vodka into a highball glass over ice cubes. Fill with tonic water, stir, and serve.",True
398,Valencia Cocktail,Ordinary Drink,Alcoholic,Cocktail glass,"Shake all ingredients with ice, strain into a cocktail glass, and serve.",True
399,Whisky Mac,Ordinary Drink,Alcoholic,Collins Glass,Pour both of the ingredients into a wine goblet with no ice.,True
400,White Lady,Ordinary Drink,Alcoholic,Cocktail glass,Add all ingredients into cocktail shaker filled with ice. Shake well and strain into large cocktail glass.,True
401,Wine Punch,Punch / Party Drink,Alcoholic,Collins Glass,Combine all of the ingredients and pour over a block of ice.,True
402,Wine Cooler,Punch / Party Drink,Optional alcohol,Collins Glass,Mix wine and soft drink. Pour into glass. Add ice.,False
403,Winter Rita,Beer,Alcoholic,Highball Glass,"Salt rim. Combine all ingredients, shake with ice, and strain over fresh ice.⠀",True
404,Whiskey Sour,Ordinary Drink,Alcoholic,Old-fashioned glass,"Shake with ice. Strain into chilled glass, garnish and serve. If served 'On the rocks', strain ingredients into old-fashioned glass filled with ice.",True
405,White Russian,Ordinary Drink,Alcoholic,Old-fashioned glass,Pour vodka and coffee liqueur over ice cubes in an old-fashioned glass. Fill with light cream and serve.,True
406,Winter Paloma,Cocktail,Alcoholic,Highball glass,Everyone’s favourite Paloma gets a delicious Indian makeover. Tequila reposado infused with “Timur Pepper” which has citrusy & grapefruit notes and is grown at the foothills of Himalaya. It also produces a slightly numbing and tingling sensation on your lip when consumed. We have also spiced up the fresh grapefruit juice with the warming spice blend from Himalaya. The combination of all these interesting elements has allowed us to elevate your Paloma sipping experience.,True
407,White Wine Sangria,Punch / Party Drink,Alcoholic,Pitcher,"Chop the Lemon, Lime and other fruits into large chunks. Fill the Pitcher with the white wine and mix in the Apple Brandy. Top to taste with soda water.",True
408,Whitecap Margarita,Other / Unknown,Alcoholic,Margarita/Coupette glass,Place all ingredients in a blender and blend until smooth. This makes one drink.,True
409,Waikiki Beachcomber,Ordinary Drink,Alcoholic,Cocktail glass,"Shake all ingredients with ice, strain into a cocktail glass, and serve.",True
410,Yellow Bird,Cocktail,Alcoholic,Cocktail glass,Shake and strain into a chilled cocktail glass,True
411,Yoghurt Cooler,Other / Unknown,Non alcoholic,Highball Glass,"Place all ingredients in the blender jar - cover and whiz on medium speed until well blended. Pour in one tall, 2 medium or 3 small glasses and drink up. Note: Use lots of ice in this one - great on hot days! To add ice: Remove the center of the cover while the blender is on - drop 3 or 4 ice cubs and blend until they're completely crushed.",False
412,Zorro,Coffee / Tea,Alcoholic,Coffee Mug,add all and pour black coffee and add whipped cream on top.,True
413,Zinger,Soft Drink,Alcoholic,Highball glass,Get a shot glass and pour in three shots of the schnapps. Do the same with the Surge Cola. Then down it like Scheetz would.,True
414,Zoksel,Soft Drink,Alcoholic,Beer pilsner,"No specific mixinginstructions, just poor every ingredient in one glass. The lemon goes with it.",True
415,Zombie,Cocktail,Alcoholic,Hurricane glass,"
Blend at high speed for no more than 5 seconds.

Pour into a glass, add ice cubes to fill, then add the garnish.

*Donn’s mix: Bring 3 crushed cinnamon sticks, 1 cup of sugar and 1 cup of water to a boil, stirring until the sugar is dissolved.

Simmer for 2 minutes, then remove from the heat and let sit for at least 2 hours before straining into a clean glass bottle.

Then add 1 part of the syrup and 2 parts of fresh grapefruit juice together.",True
416,Zambeer,Soft Drink,Alcoholic,Collins Glass,Mix sambuca with rootbeer and stir. Add ice,True
417,Zorbatini,Cocktail,Alcoholic,Cocktail glass,Prepare like a Martini. Garnish with a green olive.,True
418,Zenmeister,Ordinary Drink,Alcoholic,Collins Glass,Mix together and enjoy,True
419,Zipperhead,Shot,Alcoholic,Whiskey sour glass,"Fill glass with rocks, add straw before putting in liquor. Then add the ingredients in order, trying to keep layered as much as possible (i.e. Chambord on bottom, then Vodka, Then soda on top).",True
420,Zima Blaster,Ordinary Drink,Alcoholic,Hurricane glass,"Fill glass with ice. Pour in Chambord, then fill with Zima. Mix and enjoy.",True
421,Zizi Coin-coin,Punch / Party Drink,Alcoholic,Margarita/Coupette glass,"Pour 5cl of Cointreau on ice, add 2cl of fresh lemon (or lime) juice, stir gently, and finally add slices of lemon/lime in glass.",True
422,Zimadori Zinger,Punch / Party Drink,Alcoholic,Collins glass,Pour Zima in a collins glass over ice and then pour the shot of Midori. Don't stir. Garnish with a cherry.,True
423,Zippy's Revenge,Cocktail,Alcoholic,Old-fashioned glass,Mix Kool-Aid to taste then add Rum and ammaretto. shake well to disolve the sugar in the Kool-Aid... serve cold,True
424,Ziemes Martini Apfelsaft,Ordinary Drink,Alcoholic,Collins Glass,Serve without ice. At least the juice shold have room temperature.,True
